{
  "name": "computer-mgmt",
  "label": "电脑管理工作流",
  "version": "1.0.0",
  "description": "电脑管理工作流蓝图（无 Epic 轻量清单模式）。证明同一引擎 + 门禁能驱动非客户端、可无 Epic 的流程；门禁只按各 stage planFolder 扫子 Plan 存在性。",
  "usesEpic": false,
  "planRoot": "Plans/电脑管理",
  "bootScript": "scripts/full-cycle-boot.sh",
  "gateScript": "scripts/workflow-gate.sh",
  "triggerHints": [
    "电脑管理",
    "清理电脑",
    "整理电脑",
    "磁盘清理",
    "系统加固",
    "备份",
    "帮我清理"
  ],
  "epicMapping": {},
  "stages": [
    {
      "key": "inventory",
      "label": "盘点（磁盘/应用/启动项/大文件）",
      "planFolder": "Plans/电脑管理",
      "planPrefix": "盘点",
      "skills": ["material-prep-assistant"],
      "wbsSlices": [1],
      "exitCriteria": {
        "childPlanExists": true,
        "skillRun": true
      },
      "next": "cleanup"
    },
    {
      "key": "cleanup",
      "label": "清理（缓存/临时/无用应用）",
      "planFolder": "Plans/电脑管理",
      "planPrefix": "清理",
      "skills": ["material-prep-assistant"],
      "wbsSlices": [2],
      "exitCriteria": {
        "childPlanExists": true,
        "skillRun": true
      },
      "next": "backup"
    },
    {
      "key": "backup",
      "label": "备份（关键数据/配置）",
      "planFolder": "Plans/电脑管理",
      "planPrefix": "备份",
      "skills": ["material-prep-assistant"],
      "wbsSlices": [3],
      "exitCriteria": {
        "childPlanExists": true,
        "skillRun": true
      },
      "next": "harden"
    },
    {
      "key": "harden",
      "label": "加固（安全/权限/更新）",
      "planFolder": "Plans/电脑管理",
      "planPrefix": "加固",
      "skills": ["material-prep-assistant"],
      "wbsSlices": [4],
      "exitCriteria": {
        "childPlanExists": true,
        "skillRun": true
      },
      "next": "review"
    },
    {
      "key": "review",
      "label": "复核（结果核对 + 归档）",
      "planFolder": "Plans/电脑管理",
      "planPrefix": "复核",
      "skills": ["review-assistant"],
      "wbsSlices": [5],
      "exitCriteria": {
        "childPlanExists": true,
        "skillRun": true
      },
      "next": "done"
    }
  ],
  "reporting": {
    "format": "📌 当前阶段：[{state}] | 下一个阶段：[{next}] | 如需中断：/resume plan={planPath}"
  }
}
